Headline,Body ID,Stance
"No, Vladimir Putin did not get pooped on by a bird during a First World War speech",2081,agree
Nationwide turkey recall? Ebola-infected birds? USDA debunks the hoax,1299,unrelated
"Nun Complains Of Stomach Pains, Later Gives Birth To Baby Boy",2009,unrelated
Seth Rogen Is Woz,712,discuss
"Dogs DO go to heaven… and cats, and horses: Pope assures young boy that there is a place in paradise for animals as well",2297,agree
"Boko Haram Could Release Kidnapped Girls, Nigerian Officials Say",1506,unrelated
ISIS Appears To Behead American Photojournalist In YouTube Video,2453,unrelated
Judd Nelson Death Hoax: FOX News Impersonator Claims Actor Found Dead In Los Angeles Condo,1020,unrelated
BATMAN VS. SUPERMAN BATMOBILE STOLEN,2062,discuss
Islamic State May Have Fighter Jets Now After Seizing Russian-Made MiGs,524,unrelated
"Insiders Claim Steel Apple Watch to Start at $500, Gold at $4,000",2277,discuss
Police find mass graves with at least '15 bodies' near Mexico town where 43 students disappeared after police clash,1351,unrelated
Macaulay Culkin: Death claims about former child star revealed to be yet another hoax,1012,unrelated
IS militant 'Jihadi John' named as Mohammed Emwazi from London,2184,unrelated
James Foley remembered as 'brave and tireless' journalist,1786,unrelated
Judd Nelson isn't dead; report is a hoax,2281,unrelated
"Luke Somers, American Hostage, Is Killed During Rescue Attempt in Yemen, U.S. Official Says",487,unrelated
Saudi cleric issues fatwa against building snowmen,760,unrelated
Report: NYPD to stop arresting people for minor marijuana offenses,2372,discuss
"Nigeria claims deal with Boko Haram on ceasefire, kidnapped girls",800,unrelated
‘Wild Misinformation’: Brian Williams Explains the Mike Seidel Liveshot,205,unrelated
Report claims Kim Jong-un underwent surgery to repair fractured ankles,798,discuss
Christian Bale won't play Steve Jobs,919,unrelated
"Don't Worry, 'The Breakfast Club' Star Judd Nelson Is Not Dead",1906,unrelated
"Apple Watch to Be Shower-Proof, Have 100,000 Apps at Launch: Reports",62,unrelated
Video Purports to Show Beheading of American Journalist,1120,unrelated
"Apple Media Event Rumored for Late February, Apple Watch and 12"" MacBook Air Likely Topics [Updated]",1481,unrelated
Apple Watch launch has new timetable: Analyst,2116,unrelated
Boyfriend cuts off his penis and throws it in the bin after girlfriend dumps him for being bad in bed,1465,unrelated
NEWS/ You'll Never Guess How a Homeless Man Spent $100—Watch the Touching Video!,1996,agree
Report: Secret Service Lied About White House Fence Jumper,2329,unrelated
ISIS Seemingly Beheaded American Journalist James Wright Foley,26,unrelated
Anna Wintour 'refuses to work at new World Trade Center Vogue office due to rat infestation',493,unrelated
ISIS leader dead?,1921,unrelated
"Rumor: Gold Apple Watch Edition priced up to $5,000, steel version at $500, will debut on Feb. 14",2421,unrelated
Attorney: New audio reveals pause in gunfire when Michael Brown was shot,1817,discuss
SHOCKING: Indian Man's Penis Cut-off After He Was Caught Attempting Rape [Photos],2106,unrelated
"Gill Rosenberg, Canadian citizen, reportedly captured by ISIS in Syria",2147,unrelated
Apple-HBO Deal Seen Launching Web-only Apple TV Streaming Service For $15 Per Month,516,unrelated
Bali Awry,1923,discuss
Incredible Video Shows A US Marine Surviving Being Shot In The Head By A Sniper In Afghanistan,2421,unrelated
CNN Airs Alleged Audio from Michael Brown Shooting,1916,discuss
#RIPFidel fuels false rumors of Cuban leader's death after another Fidel Castro dies,1918,discuss
ISIS cracks down on five confirmed Ebola cases among fighters: official,1506,discuss
Devoted pet owner spends £300 to save his GOLDFISH after it became constipated,1361,unrelated
Now the Vogue Rats Are Chewing Through Couture,30,unrelated
Nicaragua Meteorite Impact Theory May Be Meteor-wrong,1790,discuss
Seth Rogen to play Woz in Jobs biopic,1083,unrelated
"Thanks Uncle Sam, we have your weapons airdrop: ISIS taunts America over intercepted weapons meant for Kurds",693,unrelated
Latest iOS 8 bug reportedly causes unwanted deletion of iCloud Drive documents,1155,unrelated
Sugarhill Gang co-founder Big Bank Hank dies,40,unrelated
British Man Slaps People If They Sneeze In Public,1478,unrelated
Wife and child of Islamic State leader Baghdadi held in Lebanon,651,unrelated
"Batmobile Stolen From ""Batman v Superman: Dawn of Justice"" Set, Zack Snyder Knows Who Did It",87,unrelated
Report: Nigerian Woman Quarantined in KC with Ebola-Like Symptoms (Video),1843,unrelated
"Christian Bale passes on role of Steve Jobs, actor reportedly felt he wasn't right for part",630,unrelated
Apple may launch 12-inch MacBook Air with Retina Display,777,unrelated
Here Are Microsoft's New Robot Security Guards,1646,unrelated
We took a look at the photo said to show the body of Islamic State leader Abu Bakr Al-Baghdadi (right) and found it was really an ethnic Albanian militant killed in 2013,263,agree
Texas plumber's truck spotted in Syria: 'We have nothing to do with terror at all',917,unrelated
"Kim Yo Jong, Kim Jong-Un’s Sister, Takes Control of North Korea While Brother Gets Treatment?",565,unrelated
"Islamic State training pilots to fly MiG fighter planes, says monitoring group",2342,unrelated
ISIS Claims to Have Intercepted Supplies From U.S. Airdrop,1648,unrelated
Audio of gunfire in Michael Brown case authenticated by app company,2220,discuss
God Is A Woman – Resurrected Father Narated,1877,unrelated
ISLAMIC STATE BEHEADS MISSING AMERICAN JOURNALIST JAMES WRIGHT FOLEY,1786,unrelated
YPG Confirms: Gill Rosenberg Not Captured in Kobani,346,discuss
"Islamic State, in video titled ""A Message to America,"" beheads American journalist James Wright Foley who was kidnapped in 2012",1295,unrelated
Missing Mexican students 'not found in mass grave',1351,unrelated
Christian Bale to play Steve Jobs in upcoming biopic,298,unrelated
Jordanian airstrike killed American aid worker held hostage by ISIS according to statement by militants,754,discuss
DNA test confirms child is IS head Abu Bakr al-Baghdadi's daughter,682,unrelated
Dog abandoned at Ayr station with belongings in suitcase,650,unrelated
David Haines beheading video confirmed genuine; UK PM Cameron vows to hunt down ISIS 'monsters',1360,unrelated
Someone painted a graffiti dick on a $2.5 million car,822,unrelated
A bunch of cool health features were cut from the Apple Watch at the last minute,757,unrelated
IS militant 'Jihadi John' named as Mohammed Emwazi from London,2125,unrelated
TBS speeds up Seinfeld 7.5% to gain an extra 2 minutes of commercial ad time.,612,unrelated
Who Is Michael Zehaf-Bibeau? Ottawa Shooter Suspect Identified By Canadian Officials ,2404,unrelated
Abdel-Majed Abdel Bary: London Rapper Identified As ISIS Militant Who Beheaded James Foley,195,unrelated
Did Josh Paler Lin Stage His Viral Video About Helping the Homeless?,467,unrelated
Ferguson riots: audio may have captured Michael Brown shooting,456,unrelated
"Woman detained in Lebanon is not al-Baghdadi's wife, Iraq says",2453,unrelated
"After Giving A Homeless Man $100, This Guy Secretly Filmed Him...",742,unrelated
Texas Plumber Has ‘No Idea’ How Company Truck Ended Up With ISIS,2015,agree
Student accidentally sets college on fire during fireworks proposal,1651,unrelated
Weather Channel’s Mike Seidel was not caught with his pants down,2092,unrelated
Vogue’s Shiny New Office Has a Big Rat Problem,2031,agree
Was The Video Of That Homeless Man Doing Good Deeds With $100 All An Elaborate Hoax!?,320,unrelated
Is Ebola Virus Spreading Among ISIS Militants? Reports Claim Jihadists Seeking Cure at Mosul Hospital,1669,discuss
Islamic State Militants Claim to Have Beheaded US Journalist James Wright Foley,533,unrelated
"Woman At Dulles Plays It Safe, Wears A Rain Poncho And Mask",1885,unrelated
NASA Confirms Earth Will Experience 6 Days of Total Darkness in December 2014!,2423,unrelated
Congressman: ‘At least 10 ISIS fighters’ caught trying to cross into US,2093,discuss
Widower Cries Tears Of Joy After Hearing Late Wife's Voice Again,1640,agree
REPORT: JETLINERS STOLEN FROM LIBYA COULD BE USED TO ATTACK U.S. ON 9/11,126,unrelated
Zack Snyder Makes Fun of Stolen Batmobile Rumor with New Image,1883,unrelated
"Tom Brokaw 'wants Brian Williams out': NBC legend 'furious' at Iraq war lie, as it's claimed executives warned anchor to stop exaggerating the story in the past",1545,unrelated
Vice CEO Throws Down $300K on Lavish Vegas Dinner,32,unrelated
ISIS Beheading of U.S. Journalist James Foley Posted to YouTube,1116,discuss
AWESOME! Canadian Parliament’s Sergeant-at-Arms Kevin Vickers Takes Out Gunman,2104,unrelated
Lynch Mob Castrates Alleged Rapist In Rajasthan,1355,unrelated
Homeless man receives $100... then shocks everyone with how he spends it,1611,discuss
US probing claims ISIS fighters seized airdropped weapons meant for Kurds,2295,discuss
Hundreds mourn the 'death' of Fidel Castro after rumours sweep Twitter (but are they confusing him with recently departed Fidel Castro Odinga from Nairobi?),1026,unrelated
WFB’s Bill Gertz: Obama Administration ‘Trying to Play Down’ Missing Libyan Airliners,1489,unrelated
Amazon Reportedly Planning An Ad-Supported Video Service That Will Be Cheaper Than Netflix,887,unrelated
Is this the world's oldest burger? Man claims to have kept McDonald's Quarter Pounder for 20 YEARS,1939,unrelated
Devoted pet owner spends £300 to save his GOLDFISH after it became constipated,1540,unrelated
"Sons of Anarchy Movie? No, Kurt Sutter Announces Charlie Hunnam, Brad Pitt Film Article is Fake",2327,unrelated
"Lady on FB: I'm 41, Intersex, and Fucked Michael Phelps on First Date",909,unrelated
Islamic State accused of using chlorine gas on Iraqi soldiers,1267,unrelated
BREAKING: British-born hostage 'KILLED in failed rescue attempt',1119,discuss
"Islamic State leader's family detained by Lebanon, officials say",254,unrelated
Customer: I was fired for Comcast complaint,1338,unrelated
Vladimir Putin Bird Poop Video is Fake,1843,unrelated
Is the iPhone 6 Really Pulling Out Your Hair?,431,unrelated
‘Banksy’ Instagram tribute to Charlie Hebdo victims not posted by artist,26,unrelated
Journalist James Wright Foley reportedly beheaded by ISIS,2495,discuss
'The youngest martyr - the cub of al-Baghdadi': ISIS boasts a 10-year-old fighter has been killed as he went into battle with his father in Syria,1829,unrelated
Iraq Says Arrested Woman Is Not The Wife of ISIS Leader al-Baghdadi,1913,unrelated
The Case of the Stolen Batmobile Has Been Solved,251,unrelated
"Nigeria's missing girls 'to be released by Boko Haram', government aide claims",2078,unrelated
"Therefore, the ""feminist blogger"" who aborted a boy probably fake",2526,discuss
"Hostage David Haines' Murder 'Evil', PM Says",1802,unrelated
"Nigeria claims deal with Boko Haram on ceasefire, kidnapped girls",381,unrelated
"White House Fence-Jumper Overpowered Secret Service Officer, Ran Through Much of Main Floor",1365,agree
"If you really believed Colorado KFCs were selling pot, here’s a reality check",1355,unrelated
"BREAKING: Islamic State, in video, beheads American journalist James Wright Foley who was kidnapped in 2012 -@BNONews",1361,unrelated
Video: Marine survives Taliban sniper headshot thanks to helmet,709,unrelated
Islamic Militants Post Video Claiming to Show Beheading of U.S. Journalist,2386,discuss
New iOS 8 bug can delete all of your iCloud documents,1857,unrelated
America's oldest time capsule unearthed at Boston statehouse after being buried in 1795 by Sam Adams and Paul Revere,855,unrelated
Is Durex Planning To Release A Pumpkin Spice Condom?,2240,unrelated
"Priest Dies, Wakes Up, Claims God Is a Woman. Huh?",1237,unrelated
Is this the world's oldest burger? Man claims to have kept McDonald's Quarter Pounder for 20 YEARS,702,unrelated
"Obama, Outraged Over Beheading, Vows to Stay on Course",1251,unrelated
Devoted pet owner spends £300 to save his GOLDFISH after it became constipated,2410,unrelated
Dog found abandoned at Scottish train station with suitcase of belongings,1853,agree
Tiger Woods selling Swedish villa — island included,1991,agree
Kim Jong-un So Fat He Injured His Ankles,2210,unrelated
SEE IT: California homeless man uses $100 gift to give food to others,1686,unrelated
Saudi Arabian cleric issues fatwa against snowmen,2317,unrelated
Kimye’s Fault? Anna Wintour’s NYC ‘Vogue’ Offices Hit With Disgusting Rat Infestation: ‘Rat Droppings On Desks’,1543,discuss
Josh Paler Lin Gives A Homeless Man $100 And Follows Him To See How He Spends It,1245,agree
"Catholic Priest Dies for 48 Minutes, Comes Back to Life and Claims God Is Female",808,agree
"Wife, child of Islamic State head Abu Bakr al-Baghdadi held in Lebanon, officials say",2197,unrelated
Conflicting reports on alleged IS capture of Canadian woman,1690,discuss
'Electric Boogie' Developer Leaves Secret Resignation Letter To Boss At The End Of The Game (Video),972,unrelated
Obama administration DENIES congressman's claim that 'at least ten ISIS fighters have been caught coming across the Mexican border in Texas',130,unrelated
"What was fake on the Internet this week: Obama’s peace prize, pumpkin-spice condoms and insane winter snow",1708,discuss
"Nigeria Says It Struck A Cease-Fire With Boko Haram, But Are They Talking To The Right Guy?",1821,discuss
"See How This Homeless Man Spends A Hundred Dollars, And Keep A Tissue Handy [Video]",2042,unrelated
Boko Haram denies truce to release kidnapped schoolgirls,1003,unrelated
Islamic State militants claim to behead missing American journalist,1040,unrelated
Christian Bale in Talks to Star in Sony's Steve Jobs Film,1368,unrelated
US airstrike targets Al Shabaab leader Ahmed Abdi Godane in Somalia,2374,discuss
James Foley beheading: London rapper turned jihadist believed to be under investigation for murder of journalist in Syria,546,discuss
Report: Michael Phelps’ Tinder ‘Girlfriend’ Was Born Male; “We Made Love During Halftime”,1847,discuss
CPWD official sacked for absence from duty for 25 years,2280,unrelated
Say 'eh-oh!' to the Teletubbies SUN BABY - can you still recognise her after 19 years?,1738,unrelated
Is the Alleged Audio of the Gunshots That Killed Michael Brown a Hoax?,776,unrelated
"Reports Isis fighters have contracted Ebola are 'incorrect', says Iraqi health ministry",720,unrelated
NYC High School Student Nicknamed ‘Teen Wolf’ Made $72 Million On Stock Market,2078,unrelated
Jihadi John unmasked: Former Westminster University student was arrested FIVE years ago and put on a terror watch list - but he flew to Syria to join ISIS two years later,1256,unrelated
Taliban member swapped by Obama for Bowe Bergdahl tried to return to terror: report,2524,unrelated
Weatherman caught peeing live on camera,633,unrelated
"James Wright Foley, Kidnapped Journalist, Apparently Executed by ISIS",880,discuss
‘Star Wars: The Force Awakens’ May Get An Early Release Date—Report,512,discuss
"Apple Watch Pricing to Reportedly Start at $500 for Stainless Steel, $4,000 for Gold",403,unrelated
"Sorry, Fido. Pope Francis did NOT say our pets are going to heaven",686,unrelated
Microsoft Hires Dalek-style Robocops to Guard Silicon Valley HQ,552,agree
Isis militants claim to have killed US journalist James Foley,1857,unrelated
CNN Posts Alleged Audio of Michael Brown Shooting,149,discuss
"Planetary Alignment On Jan 4, 2015 Will Decrease Gravity For 5 Minutes Causing Partial Weightlessness",2020,unrelated
Meteor Leaves 40-Foot Crater Near Managua's Airport,649,unrelated
ISIS Leader Killed: Abu Bakr Al-Baghdadi Reportedly Killed By U.S. Airstrike,35,unrelated
Marijuana May Soon Spark Just a Ticket in New York,1718,unrelated
Experts: More facts needed on purported audio recording of Michael Brown shooting,1252,unrelated
Is Ebola Virus Spreading Among ISIS Militants? Reports Claim Jihadists Seeking Cure at Mosul Hospital,1034,unrelated
Schoolboy almost killed by electric shock claims he now has superpowers like Magneto,1857,unrelated
BATMAN VS. SUPERMAN BATMOBILE STOLEN,734,unrelated
Christian Bale to Play Steve Jobs in New Movie,1180,unrelated
ISIS Blasts 'Scorpion Bombs' At Civilian Areas In Iraq; Mosul Residents Living In Fear,922,unrelated
Kurds fear Isis use of chemical weapon in Kobani,1020,unrelated
Durex is not confirming or denying rumors of a “pumpkin spice” condom,788,unrelated
Macaulay Culkin Hasn’t Died Despite What Everyone Is Saying On Facebook,1905,unrelated
ISIS Video Claims to Show Beheading of British Hostage,737,unrelated
Return of the Mac: Seth Rogen in talks to star as Apple co-founder Steve Wozniak in upcoming Steve Jobs biopic,1588,unrelated
Hundreds mourn the 'death' of Fidel Castro after rumours sweep Twitter (but are they confusing him with recently departed Fidel Castro Odinga from Nairobi?),1534,unrelated
"Wildest Apple Watch rumor yet: 100,000 apps at launch",1530,unrelated
Rapper identified as James Foley's executioner: reports,1237,unrelated
"No, ESPN is not having an all-male domestic violence panel tonight",1374,unrelated
BREAKING: British-born hostage 'KILLED in failed rescue attempt',1789,unrelated
Airport worker strips naked at security scanner in protest against guards,2248,unrelated
"Israel opens dams, floods Gaza",132,unrelated
Robert Plant ripped up $800M Led Zeppelin reunion contract,158,unrelated
Is Kim Jong Un's sister Kim Yo Jong in charge?,2072,unrelated
Texas Truck Winds Up in Syria With Islamic Militants,2344,unrelated
Audio of gunfire in Michael Brown case authenticated by app company,844,unrelated
Soldier shot in Ottawa at War Memorial,1256,unrelated
Woman spends a week in KFC to get over her break up,1551,agree
Rajasthan: Angry mob teaches rapist a lesson; chops penis off,1673,agree
Report: Secret Service Lied About White House Fence Jumper,1137,unrelated
Report: A Radically Redesigned 12-Inch MacBook Air Is Coming,2177,unrelated
"Rumor: Stainless Steel Apple Watch Will Cost $500, Gold $4,000",1240,unrelated
"So, There Might Be a Rat Infestation at Vogue",280,unrelated
Parents are furious after seven girls aged 13-14 fall pregnant on a school trip,2125,disagree
HORROR: ISIS Fighters Have Reportedly Contracted Ebola,2025,discuss
"James Foley: American Journalist, James Wright Foley Beheaded in New ISIS Video [Breaking News]",1120,unrelated
TBS speeds up Seinfeld 7.5% to gain an extra 2 minutes of commercial ad time.,1921,unrelated
Terrorism fears rise amid reports of stolen jetliners,634,unrelated
Islamic State using 'SCORPION bombs' to terrorise victims,2127,unrelated
Update: Did Boston.com Make Up This Story About The Web Sheriff Ben Edelman Sending Racist Emails?,480,unrelated
White House Fence Jumper Pushed Past Female Guard,263,unrelated
Jordan’s King May Participate Personally In ISIS Raids,2433,discuss
Rep. Duncan Hunter: 'At Least 10' ISIS Fighters Caught at Mexican Border,1483,unrelated
Court Orders Probe Into Complaints Of 'Forced Castration' In Religious 'Dera' Sect,1950,unrelated
Christian Bale Won't Play Steve Jobs After All,755,agree
Large space object slams Nicaragua’s capital as asteroid passes Earth,388,unrelated
Former British Rapper Reportedly Under Investigation for James Foley Beheading,29,discuss
The pumpkin spice condom is not happening,242,unrelated
Purdon Ebola Hoax: ‘Texas Town Quarantined After Family Of Five Test Positive For The Ebola Virus’ Article is Fake,1383,unrelated
ISIL Beheads American Photojournalist in Iraq,1840,unrelated
Soldier shot at War Memorial; multiple shots fired in Parliament,388,unrelated
Here Are Microsoft's New Robot Security Guards,1074,unrelated
Video shows ISIL beheading of photojournalist James Foley,938,unrelated
‘Photo of slain IS leader’ reported to be doctored,731,discuss
Watch NAKED airport worker walk through scanner in bizarre protest against 'rough' guards,2187,unrelated
Nigeria says it has deal with Boko Haram to release kidnapped girls,2191,discuss
"James Foley, Missing American Photojournalist, Reportedly Executed By ISIS In Syria",119,unrelated
"Boko Haram leader denies ceasefire deal, says 200 abducted girls married off ",2192,unrelated
Setting the record straight on tor,1589,unrelated
Islamic State Flying Three Jets in Syria,2188,unrelated
Unverified video shows beheading of aid worker David Haines,882,unrelated
ISIS Fighters Getting Caught Coming Across the U.S.-Mexican Border?,1358,unrelated
Nigeria and Boko Haram 'agree ceasefire and girls' release',402,unrelated
Report: Amazon to Launch Ad-Supported Streaming Service,2129,unrelated
What Glenn Beck Fears May Be Done With the 11 Missing Jets,1022,unrelated
"Stainless steel Apple Watch could cost just $499, but gold will be 10 times as pricey",1672,discuss
Obama: murder of James Foley 'shocks the conscience of the entire world',1166,unrelated
Nicaraguan commission on possible meteorite crash presents rock samples,1071,unrelated
Did Paul Rudd Help Tackle That Dallas Airport Gay-Basher?,1814,unrelated
"One gunman killed in shooting on Parliament Hill in Ottawa, hunt on for other shooters",2338,unrelated
Big Bank Hank of The Sugarhill Gang is dead at 57,1831,agree
Report: British intelligence has identified Foley's killer,975,unrelated
Video Purports To Show Beheading Of U.S. Journalist By Militants,1347,unrelated
"Apple Watch Pricing to Reportedly Start at $500 for Stainless Steel, $4,000 for Gold",648,unrelated
Taylor Lianne Chandler: Michael Phelps' Cougar Girlfriend Revealed?,2314,unrelated
Nigeria Claims Boko Haram Will Release the Kidnapped Schoolgirls,2156,unrelated
ISIL Beheads American Photojournalist in Iraq,1857,unrelated
Isis claims to behead US journalist,1116,discuss
US confirms death of Somalia terror group leader,882,unrelated
Oscar winner Christian Bale to play Steve Jobs in upcoming biopic,945,agree
US officials: Video shows American's execution,1589,discuss
"Kim Yo Jong, Kim Jong-Un’s Sister, Takes Control of North Korea While Brother Gets Treatment?",1817,unrelated
Graphic Photo: Oliver Ilic Uses Razor Blade To Slice Off Own Manhood After Girlfriend Broke Up With Him,562,unrelated
DNA Tests Confirm Lebanon Is Holding ISIS Leader’s Child,2042,unrelated
ISIL Beheads American Photojournalist in Iraq,2261,unrelated
This Selfless Homeless Man Receives $100 & Doesn't Spend A Dime On Himself!,467,unrelated
Russian TV actor wakes up to find his testicles stolen,1015,unrelated
Conde Nast's rat problem at One World Trade Centre: From red carpets to rodent droppings,367,unrelated
More American Weapons for ISIS,1239,unrelated
"SMALL METEORITE STRIKES NICARAGUA, GOVERNMENT SAYS",1213,discuss
"Google seals massive Sunnyvale, Redwood City deals",993,unrelated
"UPDATE: Soldier, gunman who died in Ottawa rampage identified",690,unrelated
Homeland Security: No ISIL fighters on U.S. border,251,unrelated
"Once Again, The Banksy 'Arrest' Is A Giant Hoax. Repeat: A Hoax.",1544,unrelated
Al-Shabab leader who ordered Kenya mall massacre believed killed in US drone attack in Somalia,1306,discuss
"Boko Haram Cease-Fire: Abducted Nigerian Schoolgirls To Be Released, Officials Say",1883,unrelated
"How did Fake Chinese News Site Dupe Washington Post, Atlantic, BBC?",322,unrelated
Insurgents killed in Nigeria despite alleged truce with Boko Haram,1697,unrelated
Did Josh Paler Lin Stage His Viral Video About Helping the Homeless?,2305,disagree
Meteorite leaves crater in Nicaraguan capital Managua,534,unrelated
"ISIS Video Shows Execution of David Cawthorne Haines, British Aid Worker",2034,unrelated
Zack Snyder Responds to Fake Stolen Batmobile Report,1807,unrelated
UPDATE: BATMAN v SUPERMAN Batmobile Reportedly Stolen By (Shocker!) Detroit Locals,2062,discuss
'Sex attacker' has penis cut off with a cleaver in India,36,unrelated
This Is a Truly Horrifying Story About a Spider,1826,unrelated
Jihadi John: Mohammed Emwazi named as masked man behind ISIS beheadings,2202,discuss
White House fence-jumper made it far deeper into building than previously known,887,unrelated
Give a homeless man $100 and see what he does with it [Video],321,unrelated
KIM DINE WITH ME: Porky president Kim Jong-un to open UK restaurant serving DOG,2192,discuss
Islamic State releases video apparently showing the beheading of missing US journalist James Foley,2525,unrelated
Government fires employee who skipped work for 24 years,933,unrelated
ISIS Appears To Behead American Photojournalist In YouTube Video,1747,discuss
"North Korea leader Kim is still in charge, has injured leg: source",527,unrelated
This College Student Claims She Was The 'Teletubbies' Sun Baby,979,unrelated
British aid worker David Haines beheaded by ISIL,15,unrelated
HBO Reportedly in Talks with Apple for Launch of New Unbundled Streaming Service,1660,unrelated
Angry mob chops off man's genitals with butcher’s knife for alleged rape attempt,1829,unrelated
That Boko Haram Ceasefire in Nigeria Isn’t A Ceasefire,955,disagree
Christian Bale In Talks To Play Steve Jobs In Sony's Next Biopic,830,unrelated
Bodies In Mexico Mass Grave Apparently Not Those Of Missing Students,1419,unrelated
SEND IN THE DRONES: Predator drones flown over IS headquarters in Syria,909,unrelated
ISIS Militants Allegedly Contracted Ebola,720,unrelated
Conde Nast's rat problem at One World Trade Centre: From red carpets to rodent droppings,1582,unrelated
US airstrike targets Al Shabaab leader Ahmed Abdi Godane in Somalia,2268,unrelated
What Glenn Beck Fears May Be Done With the 11 Missing Jets,920,discuss
Michael Phelps’ ‘girlfriend’ reveals she was born a man – and never told the swimmer,2480,unrelated
