Headline,Body ID,Stance
Video Purports to Show Beheading of American Journalist,1040,unrelated
"Apple's New MacBook Will Be A Thinner, Cleaner, Faster 12-Inch MacBook Air",879,unrelated
"After Giving A Homeless Man $100, This Guy Secretly Filmed Him...",359,unrelated
Nigeria Boko Haram blamed for raids despite truce claim,34,unrelated
Alleged audio of Michael Brown shooting has surfaced,1921,unrelated
Actor has his testicles stolen after meeting ‘young blonde woman at a bar’,1365,unrelated
Nicaragua asks U.S. for help investigating meteorite crater,40,unrelated
"Apple to Take Reservations for Trying On Apple Watch, Considered Platinum Model",2106,unrelated
Nigeria announces truce with Boko Haram; fate of schoolgirls unclear,1885,discuss
"Viral Video Of Homeless Man Spending $100 On Food For Other Homeless Was Faked, Witness Says",405,unrelated
BREAKING Gill Rosenberg former IDF soldier was captured by ISIS,1899,discuss
Saudi Arabia 'fatwa over building of snowmen',190,unrelated
"Small meteorite strikes Nicaragua, government says",534,unrelated
Meteorite strike in Nicaragua puzzles experts,1790,discuss
James Foley executioner said identified as British rapper  Read more: James Foley executioner said identified as British rapper,572,unrelated
Eyewitness Says Viral Video of Homeless Man Was Staged,1478,unrelated
Dog abandoned at Ayr station with belongings in suitcase,754,unrelated
'Hairgate': iPhone 6 users encounter latest Apple problem after 'bendgate',1769,discuss
Turkish president says American weapons drop for Kurdish fighters was 'wrong' after supplies end up in the hands of ISIS,693,unrelated
"Islamic State Militants Have Been Flying 3 Captured Warplanes Over Syrian Airport, Witnesses Say",2408,discuss
NYC High School Student Nicknamed ‘Teen Wolf’ Made $72 Million On Stock Market,171,unrelated
Is Durex Planning To Release A Pumpkin Spice Condom?,2055,discuss
ISIS Beheads Kidnapped Photojournalist James Wright Foley in Horrific Video Message to the U.S.,511,unrelated
Shocking picture shows mother trying to sell her own son to pay for twin daughter's cancer treatment,1467,unrelated
"Nigeria claims deal with Boko Haram on ceasefire, kidnapped girls",1697,unrelated
#Hairgate trends on social media: iPhone 6 users complain of ripped out hair,1787,unrelated
Amazon is opening its first physical store,703,unrelated
Has Kim's SISTER taken over North Korea? Dictator fails to show for key Communist event (but does send a nice flower basket instead),2125,unrelated
Robot security guards now patrolling Microsoft's Silicon Valley campus,1406,unrelated
"Soon Marijuana May Lead to Ticket, Not Arrest, in New York",2389,discuss
Media outlets identify 'Jihadi John',269,unrelated
Did Kim Yo-Jong Take Kim Jong Un’s Role? North Korea Ill Health Rumors Are ‘Fabricated’,1506,unrelated
ISIS Extremists Claim to Behead British Hostage David Haines,2061,unrelated
"Spider burrowed into appendix scar, crawled through WA man's body",2338,discuss
Has Kim Yo-Jong Taken Over For Kim Jong Un? Sister Assumes North Korea State Duties While Brother Undergoes Medical Treatment,1817,unrelated
HBO in talks with Apple to be launch partner for coming web service 'HBO Now',2419,unrelated
Man cut off manhood and threw it in bin after girlfriend dumped him over small penis,908,unrelated
"Boko Haram Could Release Kidnapped Girls, Nigerian Officials Say",2230,unrelated
ISIS fighters ‘have contracted Ebola’,1807,discuss
Rajasthan: Angry mob teaches rapist a lesson; chops penis off,2431,unrelated
Bodies In Mexico Mass Grave Apparently Not Those Of Missing Students,1678,unrelated
James Foley Killer ‘Jihadi John’ Believed to Be Former London Rapper Abdel-Majed Abdel Bary,1478,unrelated
"White House Fence Jumper Got Farther Than Previously Thought, Sources Say",263,unrelated
Islamic State claims it executed American photojournalist James Foley,1549,unrelated
Another American hostage at risk by Islamic state,115,unrelated
‘Jihadi John’: The Islamic State killer behind the mask is a young Londoner,2033,unrelated
Are Rumors of the Apple Watch in Feb True?,1742,unrelated
ISIL allegedly kills US journalist in video,7,unrelated
What Glenn Beck Fears May Be Done With the 11 Missing Jets,1271,unrelated
The 'cub of Baghdadi': Has this boy become the youngest victim of Isis’s use of child soldiers?,1574,unrelated
"Boko Haram denies truce, says kidnapped girls married",1921,unrelated
Apple Watch to reportedly offer 'Power Reserve' to help extend battery life,2124,discuss
"No, Banksy has not been arrested (sigh)",1940,agree
GOP Rep: ‘At Least Ten ISIS Fighters Have Been Caught Coming Across The Mexican Border’,570,unrelated
Batmobile Stolen From 'Batman V Superman: Dawn Of Justice' Set? Report Claims That One Of The Batmobile Models Is Missing! Detroit Locals Responsible?,1338,unrelated
Insurgents killed in Nigeria despite alleged truce with Boko Haram,2191,discuss
"Sadly, Pumpkin Spice Condoms Aren't A Thing After All",2354,agree
"Rumor: Gold Apple Watch Edition priced up to $5,000, steel version at $500, will debut on Feb. 14",1296,unrelated
Magic Mushrooms Found in Queen Elizabeth's Garden at Buckingham Palace,2478,agree
Zack Snyder’s ‘Batman V Superman: Dawn Of Justice’ Stolen Batmobile Rumor Put To Rest,7,unrelated
Report: ISIS Leader Abu Bakr Al-Baghdadi Assassinated In U.S. Airstrike,1889,discuss
White House fence-jumper made it far deeper into building than previously known,687,unrelated
Report: British intelligence has identified Foley's killer,2327,discuss
"ISIS Unleash ""Scorpion"" Bombs In Iraq",386,discuss
ISIL video claims beheading of kidnapped journalist James Foley,1966,discuss
Christian Bale will not play Steve Jobs,830,unrelated
Iraqi and Kurdish media reports cases of Ebola among Islamic State fighters in Mosul,225,unrelated
Mohammed Emwazi: Man identified as Isis killer 'Jihadi John' was 'stopped by MI5' while on safari holiday in Africa in 2010,472,unrelated
Michael Phelps' self-proclaimed girlfriend says she was born a BOY and reveals 'amazing' sex with Olympian,1820,agree
Lynch mob chop man's penis off after catching him allegedly trying to rape teenager,1291,unrelated
Soldier shot at War Memorial; multiple shots fired in Parliament,1670,unrelated
Canadian Michael Zehaf-Bibeau thought to be the gunman in Ottawa shooting,431,unrelated
Man discovers spider living under his skin during Bali vacation,1797,disagree
"Islamic State, in video titled ""A Message to America,"" beheads American journalist James Wright Foley who was kidnapped in 2012",511,unrelated
Audio of gunfire in Michael Brown case authenticated by app company,1900,unrelated
"L. Jinny? Abdel-Majed Abdel Bary, UK Rapper, Suspected in James Foley Killing: Reports",634,unrelated
Meteorite leaves crater in Nicaraguan capital Managua,1071,unrelated
Islamic State militants claim to behead missing American journalist,533,unrelated
"Is North Korea, world's most secret state, really planning a new restaurant in Scotland?",773,unrelated
Report: Audio Reveals Pause Between Gunshots When Michael Brown Was Shot,1403,unrelated
"Insiders Claim Steel Apple Watch to Start at $500, Gold at $4,000",521,unrelated
Conde Nast's rat problem at One World Trade Centre: From red carpets to rodent droppings,1940,unrelated
"280 Pound Catfish: Fisherman Makes Huge Catch In Italy, Catfish Could Set Record",2371,unrelated
"Reports Isis fighters have contracted Ebola are 'incorrect', says Iraqi health ministry",1921,unrelated
Macaulay Culkin Hasn’t Died Despite What Everyone Is Saying On Facebook,1545,agree
Apple Watch launch reportedly planned for February with limited supply,2278,unrelated
"White House Fence-Jumper Overpowered Secret Service Officer, Ran Through Much of Main Floor",1017,agree
ISIS Getting Ebola,1807,discuss
Libya: Missing Libya Planes Spark Security Concerns,1217,unrelated
Here's video of a bird pooping on Vladimir Putin in the middle of a speech,1697,unrelated
Boko Haram 'to release abducted schoolgirls' as part of ceasefire agreement,1588,discuss
Video: Marine saved by helmet after Taliban sniper attack,2389,unrelated
Hospital: Man not being treated for Ebola in Kansas City,1002,unrelated
CBS News Names Canadian Parliament Shooting Suspect,1569,discuss
Seth Rogen to Star as Steve Wozniak in Sony's Steve Jobs Biopic [Updated],616,unrelated
"Forget 18-karat gold, next-generation Apple Watch Edition could use platinum: Report",280,unrelated
American Predator Drone Circling Islamic State’s Stronghold,1657,discuss
"Boko Haram Denies Truce, Says Kidnapped Girls Have Been “Married Off”",1906,unrelated
Dylan Thomas Finds Tropical Spider Burrowed Under Skin,1478,agree
Did Kim Yo-Jong Take Kim Jong Un’s Role? North Korea Ill Health Rumors Are ‘Fabricated’,1627,unrelated
"Islamic State leader's family detained by Lebanon, officials say",273,discuss
Newly Discovered Mass Grave Linked to Missing Mexican Students,1912,discuss
DHS: GOP Rep.’s Claim ISIS Members Caught at U.S. Border ‘Categorically False’,1825,unrelated
Christian Bale will not play Steve Jobs,1368,unrelated
Tropical spider burrows under man's skin through scar,1708,unrelated
New Audio Allegedly Captures Moment Michael Brown Was Shot,2317,discuss
Soldier shot in Ottawa at War Memorial,1325,unrelated
Christian Bale to play Steve Jobs in upcoming biopic,286,unrelated
REPORT: JETLINERS STOLEN FROM LIBYA COULD BE USED TO ATTACK U.S. ON 9/11,653,discuss
"Jeh Johnson: Politicians Shouldn't 'Feed The Flames Of Fear' Over ISIS, Ebola",80,unrelated
Brian Williams Insists NBC News Meteorologist Did Not Pee in the Snow While on Air,1169,unrelated
"Batmobile stolen in Detroit? Good one, joker!",1237,discuss
That ESPN Domestic Violence Panel You Keep Hearing About Isn't Real,542,unrelated
Boko Haram ceasefire ignored as violence flares in Borno state,320,unrelated
Conde Nast's rat problem at One World Trade Centre: From red carpets to rodent droppings,387,unrelated
Pure Evil: Islamic State Beheads American Journalist James Wright Foley,2130,unrelated
ISIS Video: America’s Air Dropped Weapons Now in Our Hands,2252,unrelated
ISIS Hostage Alan Henning's Wife Invokes Sharia Law in New Plea,1416,discuss
"White House Fence-Jumper Overpowered Secret Service Officer, Ran Through Much of Main Floor",1426,unrelated
Say 'eh-oh!' to the Teletubbies SUN BABY - can you still recognise her after 19 years?,615,discuss
"Apple 12-Inch MacBook Air Details Emerge; Device Could Be Thinner, Lighter Than Current Model",2497,discuss
Somalia Shebab chief Ahmed Abdi Godane likely dead in US strike: Source,1936,unrelated
Web of confusion as scientists cast doubt on man's claims that a spider burrowed into his stomach through his SCAR,2297,unrelated
Militant Group Says It Killed American Journalist in Syria,1549,unrelated
"Macaulay Culkin Dead? Hoax Goes Viral, Claims Actor Found Dead in Apartment",2502,agree
UPDATE: BATMAN v SUPERMAN Batmobile Reportedly Stolen By (Shocker!) Detroit Locals,483,unrelated
"US, UK eye rapper as British-born militant who beheaded journalist James Foley",2295,unrelated
"Video showing American journalist beheaded believed real, officials and family say",1361,unrelated
Opposition group: ISIS militants training to fly warplanes in Syria,1406,unrelated
Luke Somers 'killed in failed rescue attempt in Yemen',244,unrelated
US Marine survives headshot in Afghanistan,2421,unrelated
New Audio Reveals Pause in Gunfire When Michael Brown Was Shot: Attorney,2250,discuss
Lynch mob chop man's penis off after catching him allegedly trying to rape teenager,1375,unrelated
India Rape Crisis Sees Mob Castrate Alleged Sex Attacker in Shocking Scenes,1022,agree
Report: Secret Service Lied About White House Fence Jumper,2409,discuss
"No, Robert Plant Didn’t Rip Up an $800 Million Contract",1740,unrelated
"Hoax Alert: Father O’Neal, Who Has Met God and Thinks She’s a Woman, Is Made Up (Just Like God Herself)",2142,unrelated
Google Grows With $1.6 Billion in California Office Deals,125,unrelated
Durex on Rumored ‘Pumpkin Spice’ Condom: No Comment,2152,unrelated
TBS Is Probably Speeding Up ‘Seinfeld’ Reruns To Fit In More Commercials,1883,unrelated
Obama administration DENIES congressman's claim that 'at least ten ISIS fighters have been caught coming across the Mexican border in Texas',2016,agree
"Don't forget to tip...especially if you spend $300,000",1817,unrelated
"Are missing students in mass graves found near Iguala, Mexico?",712,unrelated
"James Foley: American Journalist, James Wright Foley Beheaded in New ISIS Video [Breaking News]",1569,unrelated
"Tour, agent: Tiger Woods not banned",1795,unrelated
ISIS Fighters Getting Caught Coming Across the U.S.-Mexican Border?,704,unrelated
ISIS Claims To Have Captured US Airdrop Weapons,1785,unrelated
A Bunch Of Folks Are Passing Around This Hoax Video Of A Bird Pooping On Vladimir Putin,2502,unrelated
YPG Confirms: Gill Rosenberg Not Captured in Kobani,2067,unrelated
"Homeless man who became a YouTube sensation after spending $100 on food for his beggar friends gets a surprise Christmas meal, makeover and night in a hotel in new video... but is it all a hoax by a 'serial prankster'?",1996,discuss
Pentagon: ISIS seized materials airdropped to Kurds,1938,unrelated
American hostage in Yemen freed in military raid-Defence Ministry,1256,unrelated
IS militant 'Jihadi John' named as Mohammed Emwazi from London,2470,unrelated
Militant Group Says It Killed American Journalist in Syria,2386,discuss
Ebola Outbreak 2015 Update: ISIS Fighters May Have Contracted Deadly Virus,2025,discuss
Meteorite leaves crater in Nicaraguan capital Managua,971,unrelated
"If you really believed Colorado KFCs were selling pot, here’s a reality check",2434,unrelated
Isilkulskom student has gained superhero powers after shock,1317,unrelated
Report: Christian Bale Just Bailed on the Steve Jobs Movie,1234,unrelated
Who Is Michael Zehaf-Bibeau? Ottawa Shooter Suspect Identified By Canadian Officials ,11,unrelated
Return of the Mac: Seth Rogen in talks to star as Apple co-founder Steve Wozniak in upcoming Steve Jobs biopic,511,unrelated
Hundreds mourn the 'death' of Fidel Castro after rumours sweep Twitter (but are they confusing him with recently departed Fidel Castro Odinga from Nairobi?),93,unrelated
ISIS KILLS 300 IRAQI SOLDIERS WITH CHLORINE GAS: SHIA MP,1357,unrelated
Hope Fades for Girls' Release After Boko Haram 'Truce' Breached,1821,agree
Video: Islamic State Claims to Have Captured US Weapons Airdrop Near Kobane,2483,unrelated
"Amazon reportedly launching free, ad-supported video service (updated)",531,unrelated
Guantanamo Detainee Exchanged for American POW Attempts a Return to Battle,2236,discuss
Michael Phelps’ girlfriend Taylor Lianne Chandler reveals she was raised as a boy,89,unrelated
Macaulay Culkin dead hoax: Fake death report spreads on social networks,195,unrelated
Kurds Deny Gill Rosenberg was in Kobane,387,unrelated
Dog abandoned at Scottish rail station with suitcase full of belongings  Read more: http://www.ctvnews.ca/world/dog-abandoned-at-scottish-rail-station-with-suitcase-full-of-belongings-1.2175026#ixzz3O9Shc1IO,2483,agree
North Korea denies plans to open a restaurant in Scotland,2418,discuss
"Woman detained in Lebanon is not Isis leader’s wife, says Iraq",2265,unrelated
Actor has his testicles stolen after meeting ‘young blonde woman at a bar’,845,agree
"Boko Haram Could Release Kidnapped Girls, Nigerian Officials Say",1821,discuss
Female Israeli fighter said abducted by Islamic State  Read more: Female Israeli fighter said abducted by Islamic State,2067,unrelated
Seven girls fall pregnant after five day school trip in Bosnia and Herzegovina,2044,unrelated
Putin’s motorcade looks suspiciously like a massive…,1385,unrelated
ISIS leader dead?,1048,unrelated
"Predator Drone Reportedly Sighted Circling Raqqa, Syria",1802,unrelated
ISIS Video: America’s Air Dropped Weapons Now in Our Hands,1361,discuss
Does Vogue's New Office Have a Rat Infestation?,304,unrelated
Islamic State Militants Claim to Have Beheaded US Journalist James Wright Foley,511,unrelated
Abdel-Majed Abdel Bary in Foley beheading: London rapper songs help identify him,572,unrelated
Report: Audio Reveals Pause Between Gunshots When Michael Brown Was Shot,2481,discuss
Two GOP Congressmen Say Suspected Terrorists Caught Crossing U.S.–Mexico Border,2261,discuss
BREAKING NEWS: ISIS beheads missing American journalist James Wright Foley as warning to US to cease action in Iraq,1744,discuss
ISIS Video Purports To Show Beheading Of British Aid Worker,1757,discuss
"No, Islamic State Militants Have Not Been Caught by U.S. Border Patrol",1177,unrelated
Vogue’s Rat Infestation: Disturbing New Details,2263,agree
Taliban member swapped by Obama for Bowe Bergdahl tried to return to terror: report,2236,discuss
"What they earn: Vice CEO Shane Smith’s $300,000 steak dinner",1299,unrelated
Boko Haram 'ceasefire' doubts after attacks reported in Nigeria,1541,unrelated
Man chops off own penis after being dumped by his girlfriend,1905,unrelated
Nicaragua Meteorite Impact Theory May Be Meteor-wrong,2155,unrelated
"Rare Case: Seven Bosnian Girls, Aged 13 And 14, Fall Pregnant After Five-Day School Trip; Parents Outraged After School Cites 'Parental Neglect'",208,unrelated
"High-end Apple Watch to start at $5,000 -- analyst",2092,discuss
Taylor Lianne Chandler: Michael Phelps' Cougar Girlfriend Revealed?,1806,discuss
Has a woman aborted her baby because it's a boy?,2213,unrelated
SEE IT: California homeless man uses $100 gift to give food to others,1036,unrelated
Canadian-Israeli Woman May Have Been Captured In Syria: Reports,2037,discuss
Christian Bale will not play Steve Jobs,1658,unrelated
Hope Fades for Girls' Release After Boko Haram 'Truce' Breached,2045,unrelated
WHO says reports of suspected Ebola cases in Iraq are untrue,206,unrelated
"Vogue's Anna Wintour Pissed Off With New 1 World Trade Center Offices, Infested With Rats",891,unrelated
Unconfirmed reports claim Canadian-Israeli Gill Rosenberg captured by ISIS,214,unrelated
Did Kim Yo-Jong Take Kim Jong Un’s Role? North Korea Ill Health Rumors Are ‘Fabricated’,2473,discuss
Is Kim Jong Un's sister Kim Yo Jong in charge?,1291,unrelated
"'Star Wars VII' News, Update: JJ Abrams Pushing for Summer Release?",2434,unrelated
"Big Bank Hank, US rapper and Sugarhill Gang founder member, dies at 57",1996,unrelated
"Batmobile Stolen From ""Batman v Superman: Dawn of Justice"" Set, Zack Snyder Knows Who Did It",1852,unrelated
"Jihadi John named as Mohammed Emwazi, from west London",1256,unrelated
BREAKING Gill Rosenberg former IDF soldier was captured by ISIS,80,unrelated
More American Weapons for ISIS,2176,unrelated
TBS Is Probably Speeding Up ‘Seinfeld’ Reruns To Fit In More Commercials,1528,unrelated
"L. Jinny? Abdel-Majed Abdel Bary, UK Rapper, Suspected in James Foley Killing: Reports",1314,discuss
Abdel Majed Abdel Bary Emerges as Suspect in Foley Beheading,2434,unrelated
More than 200 kidnapped Nigerian girls to be released after deal reached with Boko Haram,1166,discuss
SEND IN THE DRONES: Predator drones flown over IS headquarters in Syria,1740,agree
Identity of ISIS terrorist known as 'Jihadi John' reportedly revealed,1780,discuss
Nun who GAVE BIRTH to baby boy after suffering agonising stomach pains 'had no idea' she was pregnant,179,agree
'There is no limit to their depravity' Islamic State FEED mother her own SON,1956,discuss
Christmas Is Cancelled: Pumpkin Spice Condoms Are a Goddamn Hoax,2123,unrelated
ISIS Getting Ebola,2177,unrelated
Anna Wintour: Is Rat Infestation At NYC ‘Vogue’ Office Kim Kardashian’s Fault?,2196,unrelated
"Sadly, Pumpkin Spice Condoms Aren't A Thing After All",1627,unrelated
Mystery man slaps shoppers around head for sneezing,992,unrelated
20 year old burger? McDonald's burger purchased in 1995 hasn't aged a bit,1500,unrelated
Islamic State releases video apparently showing the beheading of missing US journalist James Foley,903,discuss
IRAQI HEALTH OFFICIAL: EBOLA HAS KILLED 5 ISIS FIGHTERS,1615,discuss
Tropical spider burrowed under man's skin through appendix scar and lived there for THREE DAYS,1530,unrelated
Magic mushrooms found in BUCKINGHAM PALACE by Alan Titchmarsh,562,unrelated
US Marine survives headshot from Taliban (video),2046,agree
‘Wild Misinformation’: Brian Williams Explains the Mike Seidel Liveshot,975,agree
"McDonald’s Removing Big Mac, Apple Pies And Eliminating Large Size Options",2448,unrelated
Tropical spider burrowed under Bali tourist's skin,1579,discuss
Pentagon confirms al-Shabab leader killed in airstrike in Somalia,1936,unrelated
'Electric Boogie' Developer Leaves Secret Resignation Letter To Boss At The End Of The Game (Video),80,unrelated
Video shows ISIL beheading of photojournalist James Foley,2525,unrelated
Meteor Leaves 40-Foot Crater Near Managua's Airport,2061,unrelated
Iraq Denies Lebanon Captured Abu Bakr al-Baghdadi's Wife and Child,404,unrelated
British hostage David Haines beheaded by Islamic State terrorists,1097,agree
Fence-jumper made it farther in White House than Secret Service let on,1323,unrelated
NEWS/ All Dogs Go to Heaven! Pope Francis Confirms Paradise Is Open to All of God's Creatures,1905,agree
Comcast Declares War on Tor?,1104,unrelated
Female Israeli fighter said abducted by Islamic State  Read more: Female Israeli fighter said abducted by Islamic State,1240,unrelated
Pentagon: 1 weapons bundle seized by militants,2116,unrelated
Attorney: New audio reveals pause in gunfire when Michael Brown was shot,1252,unrelated
"SMALL METEORITE STRIKES NICARAGUA, GOVERNMENT SAYS",1068,discuss
"Boko Haram: Kidnapped Girls Have Been Married Off, Truce Never Happened",2088,unrelated
"Fidel Castro Is Dead, According to Viral Twitter Rumors",1305,discuss
India: 400 men cut off their testicles to 'get closer to God' following advice from 'guru',1938,unrelated
The Internet Tried To Make Axl Rose Its Latest Death Hoax Victim,144,unrelated
Video: Marine survives Taliban sniper headshot thanks to helmet,1385,unrelated
Meteorite 'caused mysterious boom in Nicaragua',800,unrelated
A Man Says Comcast Called His Boss And Got Him Fired After He Complained About Its Service,1338,unrelated
N Korean leader misses annual ritual; sister ‘takes over duties’,305,unrelated
News sites fall for Putin bird-dropping video,1087,discuss
Who Is Michael Zehaf-Bibeau? Ottawa Shooter Suspect Identified By Canadian Officials ,1751,unrelated
"Is Kim Jong-un's Sister, Kim Yo-jong, Running North Korea In His Mysterious Absence?",1926,unrelated
Will King of Jordan lead airstrikes on ISIS HIMSELF? Reports say trained pilot plans to take part in attack after quoting Clint Eastwood's Unforgiven to Congressmen,1365,unrelated
Seth Rogen may play Steve Wozniak alongside Christian Bale as Steve Jobs,1746,discuss
Video: Islamic State Claims to Have Captured US Weapons Airdrop Near Kobane,465,discuss
"Woman detained in Lebanon is not Isis leader’s wife, says Iraq",2296,unrelated
Former British Rapper Reportedly Under Investigation for James Foley Beheading,1237,unrelated
Audio recording allegedly captures moment Michael Brown was shot,1379,discuss
US Marine survives headshot in Afghanistan,1724,unrelated
Audio may have captured Michael Brown shooting,2403,unrelated
"Cook said to confirm Apple Watch is showerproof, lasts a day",2044,unrelated
British Man Slaps People If They Sneeze In Public,1952,discuss
Sugarhill Gang rapper Big Bank Hank dies aged 57,1979,unrelated
Two blokes dared to eat 20-year-old burger for charity,793,agree
New Audio Allegedly Captures Moment Michael Brown Was Shot,1921,unrelated
"Islamist Militants 'Steal' 11 Commercial Planes In Libya, Sparking Terror Attack Fears",508,discuss
"Non, le lancement du nouveau «Star Wars» ne sera pas devancé à cet été",399,unrelated
"Mass Graves Found In Mexico, Near Place Where 43 Students Went Missing",324,unrelated
"Jeh Johnson: Politicians Shouldn't 'Feed The Flames Of Fear' Over ISIS, Ebola",134,agree
"ISIS: We have our hands on weapons, ammo air-dropped by U.S.",2295,discuss
Islamic State Militants Claim to Have Beheaded US Journalist James Wright Foley,2450,discuss
"ISIS Militants In Mosul Have Contracted Ebola, Iraqi Media Sources Claim",568,unrelated
British-born rapper is main suspect in search for ISIS jihadist who beheaded James Foley,913,unrelated
Another ISIS Massacre: ISIS Kills 300 Iraqi Soldiers With Chlorine Gas,2016,unrelated
That ESPN Domestic Violence Panel You Keep Hearing About Isn't Real,51,unrelated
"""Categorically False"": DHS Debunks Right-Wing Fiction That ISIS Attempted To Cross The U.S.- Mexico Border",1890,agree
"Audio captured at time of Michael Brown shooting, company says",121,unrelated
"Report: ISIS kidnaps Canadian-Israeli, former IDF soldier who went to fight with the Kurds",1476,unrelated
US airstrike targets Al Shabaab leader Ahmed Abdi Godane in Somalia,941,unrelated
Michael Brown shooting audio caught on tape?,816,discuss
"Confusion swirls, details murky in arrest of ISIS leader's 'wife'",950,unrelated
"Is Apple about to launch a totally redesigned, 12-inch MacBook Air?",1863,unrelated
ISIS Beheads American Journalist James Foley in Video Message to U.S.,1351,unrelated
Meteorite 'caused mysterious boom in Nicaragua',1722,discuss
Mexico Says Students Not Among Dead in Mass Grave,1269,unrelated
Was The Batmobile Stolen In Detroit?,761,unrelated
CNN Airs Alleged Audio from Michael Brown Shooting,900,unrelated
Apple was forced to nix key health features from its smartwatch -- report,821,unrelated
EBay appears to be planning an Apple Watch app,1397,discuss
