Headline,Body ID,Stance
Report of Kim Jong-un’s ankle injury add fuel to rumours about his absence,2417,discuss
Guantanamo detainee who was swapped in prisoner deal for Bowe Bergdahl 'tried to rejoin 'Al Qaeda',1398,unrelated
Abdel-Majed Abdel Bary in Foley beheading: London rapper songs help identify him,1079,agree
MPs credit sergeant-at-arms for saving lives in Parliament Hill shootings,1175,unrelated
Nigeria and Boko Haram 'agree ceasefire and girls' release',298,unrelated
Unconfirmed reports saying ISIS UK Hostage David Haines Beheaded,1360,unrelated
Spider burrowed through tourist's stomach and up into his chest,2175,unrelated
Christian Bale In Talks To Play Steve Jobs In Sony's Next Biopic,1299,disagree
Apple Watch’s Power Reserve feature combats short battery life,78,unrelated
Purported ISIS claim: Jordan airstrike kills female US hostage,1769,unrelated
IS Militants Kill 300 Iraqi Soldiers with Chlorine Gas,636,agree
Hospital: Man not being treated for Ebola in Kansas City,1789,unrelated
Fence jumper reportedly made it much further into White House than Secret Service said,1921,discuss
ISIS Beheads American Journalist James Foley in Video Message to U.S.,1873,unrelated
Hunt for 'cruel' owner who abandoned dog at train station,1680,unrelated
Wife and son of Isil leader Abu Bakr al-Baghdadi 'detained at Lebanon border',404,unrelated
Ebola Outbreak 2015 Update: ISIS Fighters May Have Contracted Deadly Virus,567,discuss
Islamic State claims to have beheaded American journalist,2404,unrelated
"ISIS Militants Have Contracted Ebola: Iraqi, Kurdish Media Reports",559,unrelated
ISIS Extremists Claim to Behead British Hostage David Haines,2477,unrelated
Does ISIS Have Ebola? Probably Not! Media Reports It Anyway,311,unrelated
"Wildest Apple Watch rumor yet: 100,000 apps at launch",2090,discuss
#ISIS beheads photojournalist James Wright Foley in a massage to US to end its intervention in #Iraq.,511,unrelated
Hope Fades for Girls' Release After Boko Haram 'Truce' Breached,600,discuss
Star Wars VII for a New SUMMER Release Date!?,125,unrelated
"Lady on FB: I'm 41, Intersex, and Fucked Michael Phelps on First Date",1646,unrelated
An Audio Recording of the Michael Brown Shooting Has Reportedly Surfaced,2248,unrelated
AUSTRALIA: 600-POUND WOMAN GIVES BIRTH TO 40-POUND BABY,281,unrelated
Nicaragua asks U.S. for help investigating meteorite crater,731,unrelated
Man Known as ‘Jihadi John’ Is Identified as Mohammed Emwazi,1603,unrelated
HBO in talks with Apple to be launch partner for coming web service 'HBO Now',551,unrelated
Comcast gets customer fired for complaining about poor service,2447,unrelated
Parents are furious after seven girls aged 13-14 fall pregnant on a school trip,2508,agree
NBC weatherman caught urinating in the woods live on air,1319,agree
Is Kim Jong-Un Really Opening a Restaurant in Scotland?,2290,unrelated
Michelle Obama’s face blurred by Saudi state television,633,unrelated
"Boko Haram: Kidnapped Girls Have Been Married Off, Truce Never Happened",2356,discuss
Islamic State Militants Claim to Have Beheaded US Journalist James Wright Foley,1166,unrelated
ISIS Beheading of U.S. Journalist James Foley Posted to YouTube,2450,agree
Small Meteorite Strikes in Nicaragua's Capital City of Managua,173,agree
Saudi cleric says snowmen are anti-Islamic,2456,agree
Kim Jong-un: obese leader 'fractured both ankles',2385,unrelated
ISIS militants appear to behead abducted American journalist James Wright Foley in graphic video,704,unrelated
CNN Plays Alleged Audiotape of Michael Brown ShootingMilitarization Of Police,2434,discuss
Saudis Say Michelle Obama Not Blurred on TV,1975,agree
Google to Buy Redwood City Offices for $585M,1909,unrelated
What This Homeless Guy Did With $100 Completely Stunned The Man Who Gave It To Him,2370,unrelated
Missing Libyan jetliners raise fears of terror attacks on 9/11,1438,unrelated
Sources: Guns N' Roses Frontman Axl Rose Found Dead in West Hollywood Home at Age 52,2152,unrelated
Sugarhill Gang Rapper ‘Big Bank Hank’ Dies at 57,1996,unrelated
Missing American journalist reportedly beheaded by Islamic State ,2386,discuss
"Report: Stainless steel Apple Watch will be priced $500, gold at $5,000",1983,discuss
Libya: Missing Libya Planes Spark Security Concerns,1372,disagree
Meteorite 'caused mysterious boom in Nicaragua',2045,unrelated
"CNN Broadcasts Purported Audio Containing Gunshots That Felled Michael Brown Jr.; Leaders, Celebrities Fill Pews At Teen’s Funeral",2044,unrelated
New Rumour Suggests Apple Watch to Launch in February,822,unrelated
ISIS cracks down on five confirmed Ebola cases among fighters: official,1013,unrelated
"Apple Watch Gold Edition may cost as much as $5,000",1447,discuss
ISIL video claims beheading of kidnapped journalist James Foley,1569,unrelated
"Lady on FB: I'm 41, Intersex, and Fucked Michael Phelps on First Date",1897,unrelated
Christian Bale will not play Steve Jobs,2097,unrelated
"Nigeria, Boko Haram reach ceasefire deal, kidnapped girls to go free, official says",1125,unrelated
Ferguson riots: audio may have captured Michael Brown shooting,1009,discuss
Indian worker sacked after going on leave for 24 years,1457,unrelated
WHO says reports of suspected Ebola cases in Iraq are untrue,2096,unrelated
Kim Had Ankle Surgery:  Source,2344,unrelated
"Apple Watch to Be Shower-Proof, Have 100,000 Apps at Launch: Reports",752,unrelated
CNN Posts Alleged Audio of Michael Brown Shooting,1893,unrelated
"That Story About a Catholic Priest Dying, Seeing God as a Woman, and Coming Back to Life? It’s Almost Definitely Fake",777,unrelated
"""Categorically False"": DHS Debunks Right-Wing Fiction That ISIS Attempted To Cross The U.S.- Mexico Border",2132,unrelated
It’s About To Get Harder To Be Arrested For Pot Possession In New York City,1192,unrelated
‘Jihadi John’: The Islamic State killer behind the mask is a young Londoner,1437,unrelated
"Tiger Woods PED, PGA Tour Suspension Allegations Retracted by Dan Olsen",235,unrelated
ISIS Fighters Getting Caught Coming Across the U.S.-Mexican Border?,2526,unrelated
BREAKING NEWS: Baseball star Jose Canseco hurt in accidental shooting,2352,agree
PGA Tour Denies Claim That Tiger Woods Failed A Drug Test,2330,agree
"Why the most expensive Apple Watch will probably cost around $10,000",1631,unrelated
Another American hostage at risk by Islamic state,874,unrelated
"How did Fake Chinese News Site Dupe Washington Post, Atlantic, BBC?",648,agree
Soldier shot near Canadian parliament building,1009,unrelated
‘Jihadi John’: The Islamic State killer behind the mask is a young Londoner,908,unrelated
Nigeria: hopes for return of kidnapped schoolgirls rise after ceasefire reported,1603,unrelated
Chinese parents try to SELL their son to pay for medical treatment for his sick twin sister,1698,agree
Star Wars: The Force Awakens to be released this summer?,1148,unrelated
Did NBC Nightly News Go Live To A Man Who Was Taking A Piss?,1333,discuss
Second person rushed to hospital with Ebola symptoms after contact with 'patient zero' Thomas Duncan,1481,unrelated
"What We Know About Kim Yo Jong, Who May Control North Korea",2344,discuss
Update: Did Boston.com Make Up This Story About The Web Sheriff Ben Edelman Sending Racist Emails?,1049,unrelated
"12in Retina MacBook Air release date rumours: All-new 12in MacBook Air design for 2015, launching at WWDC?",1545,unrelated
"US hostage 'murdered' by militants in Yemen, says Hagel",825,discuss
"Amazon reportedly launching free, ad-supported video service (updated)",1408,unrelated
Kidnapped Nigerian schoolgirls: Government claims ceasefire deal with Boko Haram that will bring missing girls home,34,unrelated
U.S. arms airdrop fell into ISIS hands: Pentagon,2116,unrelated
Mexico Says Missing Students Not Found In First Mass Graves,2360,unrelated
Report: British intelligence has identified Foley's killer,2295,unrelated
"Meteorite Strikes Nicaraguan Capital, Creates 16-Foot-Deep Crater",1722,discuss
"Christian Bale passes on role of Steve Jobs, actor reportedly felt he wasn't right for part",932,unrelated
Matt Taibbi Disappears From Omidyar’s First Look Media,2188,unrelated
Here Are Microsoft's New Robot Security Guards,2529,agree
Boko Haram denies ceasefire claim by Nigeria's government,304,unrelated
Senior Western Intelligence Official Confirms London Rapper Abdel Majed Abdel Bary Is A Suspect In The Foley Killing,1427,unrelated
"Tiger Woods is not on suspension for failing a drug test, his agent and a PGA official say",550,unrelated
The Guy Who Said a Spider Burrowed Under His Skin? Experts Say…,214,unrelated
"Fidel Castro Is Dead, According to Viral Twitter Rumors",125,unrelated
"Nigeria Says It Struck A Cease-Fire With Boko Haram, But Are They Talking To The Right Guy?",298,unrelated
"Nigeria's missing girls 'to be released by Boko Haram', government aide claims",1003,unrelated
Nasa’s ‘six days of total darkness in December 2014’ is a hoax,2423,unrelated
CNN Plays Alleged Audiotape of Michael Brown ShootingMilitarization Of Police,1795,unrelated
Research Medical Center denies reports that a patient has Ebola,99,unrelated
"Sadly, Pumpkin Spice Condoms Aren't A Thing After All",119,unrelated
Pentagon Denies It Killed ISIS Chief As Airstrikes Hit Top Extremists,1048,unrelated
Nun gives birth to surprise baby after complaining of stomach pains,433,discuss
Nigeria says ceasefire agreed with Boko Haram,1298,discuss
Missing Libyan jetliners raise fears of terror attacks on 9/11,1958,agree
Nicaragua Meteorite Impact Theory May Be Meteor-wrong,269,unrelated
U.S. arms airdrop fell into ISIS hands: Pentagon,2397,discuss
Apple Watch won’t be the digital doctor it could have been,2409,unrelated
"Michael Zehaf-Bibeau, slain Ottawa shooter, had criminal record in Quebec, B.C.",1739,unrelated
Video: Islamic State Claims to Have Captured US Weapons Airdrop Near Kobane,1239,unrelated
There has been a shooting at the War Memorial on Parliament Hill. Unconfirmed reports say a soldier was shot.,1089,discuss
This Dog Was Left At A Railway Station With A Suitcase Of His Belongings After He Was Sold On Gumtree,269,unrelated
ISIS Appears To Behead American Photojournalist In YouTube Video,2450,discuss
"Nigeria, Boko Haram reach ceasefire deal, kidnapped girls to go free, official says",2314,unrelated
Christian Bale Drops Out of Steve Jobs Biopic,571,unrelated
Report: Secret Service Lied About White House Fence Jumper,716,discuss
WHO investigates media reports ISIS fighters contracted Ebola,1891,discuss
"Apple: Citi Sees $550 and $950 Apple Watches, Accessory Plethora",2414,unrelated
Islamic State claims it executed American photojournalist James Foley,1720,unrelated
Source: Tom Brokaw Wants Brian Williams Fired,2440,unrelated
Report: Exec popped for $300k dinner after run at blackjack,570,unrelated
Boko Haram denies truce to release kidnapped schoolgirls,2078,unrelated
Lawmaker Says ‘At Least 10′ Islamic State Fighters Have Been Captured at the Southern U.S. Border,719,unrelated
Axl Rose Dead? Fans Freak Out Over Death Rumors,2166,agree
"James Foley: American Journalist, James Wright Foley Beheaded in New ISIS Video [Breaking News]",1966,agree
Nigeria: hopes for return of kidnapped schoolgirls rise after ceasefire reported,1883,unrelated
Iraqi media says ISIS militants have contracted Ebola,225,unrelated
Turkish president says American weapons drop for Kurdish fighters was 'wrong' after supplies end up in the hands of ISIS,1949,agree
Watch US Marine get shot in HEAD by Taliban sniper - and live to tell tale,662,unrelated
Islamic State Leader al-Baghdadi “Not Dead”,1473,disagree
Meteorite leaves crater in Nicaraguan capital Managua,586,unrelated
"Paradise is open to all, even dogs, Pope tells boy",1347,unrelated
Daash Ebola transferred to Mosul {Google Translate],2463,unrelated
Official: Gitmo prisoner traded for Bergdahl reaching out to Taliban,819,unrelated
This Kid Made $72 Million During Lunch,1042,disagree
Married TV actor wakes up to find his testicles have been STOLEN after he is drugged in Russian bar by attractive blonde working for organ traffickers,91,unrelated
"Wildest Apple Watch rumor yet: 100,000 apps at launch",1708,unrelated
"Michael Zehaf-Bibeau, slain Ottawa shooter, had criminal record in Quebec, B.C.",1921,unrelated
Seth Rogen to play Woz in Jobs biopic,1574,unrelated
Has Kim's SISTER taken over North Korea? Dictator fails to show for key Communist event (but does send a nice flower basket instead),2470,discuss
The Arrest of the ISIS Leader's Wife and Son,2268,discuss
Google said to buy six silicon valley buildings for $585 million,2329,discuss
Report: Possible audio tape of Michael Brown shooting,900,unrelated
Rodney Constantine keeps Facebook promise and turns himself in to police,467,unrelated
Boko Haram Denies Nigeria Cease-Fire Claim,1883,unrelated
Nigeria Boko Haram blamed for raids despite truce claim,1896,discuss
"McDonald’s Removing Big Mac, Apple Pies And Eliminating Large Size Options",1026,agree
"No, there aren’t any Ebola cases in Iraq",267,unrelated
BREAKING UDPATED: ISIS REPORTEDLY USE CHEMICAL WEAPONS IN KOBANE,944,unrelated
Michael Phelps Sex Scandal: Troubled Olympian’s Girlfriend Was Born A Man!,330,unrelated
Two blokes dared to eat 20-year-old burger for charity,267,unrelated
ISIS Appears To Behead American Photojournalist In YouTube Video,826,unrelated
ISIL Beheads American Photojournalist in Iraq,428,unrelated
YPG Confirms: Gill Rosenberg Not Captured in Kobani,760,unrelated
Rajasthan: Angry mob teaches rapist a lesson; chops penis off,1680,unrelated
"Islamic State training fighter pilots in captured jets, monitoring group says",524,unrelated
Shots Heard In Alleged Brown Shooting Recording [AUDIO],721,discuss
Alleged Ottawa gunman: What we know so far about Michael Zehaf-Bibeau,2489,unrelated
Nigeria says it has deal with Boko Haram to release kidnapped girls,1637,unrelated
Rumor: Seth Rogen to Appear as Woz in Sony's Steve Jobs Film,1262,discuss
Small red book among finds in 113-year-old Boston time capsule,1239,unrelated
North Korea dictator Kim Jong-un undergoes surgery after breaking both ankles on military tour,1854,discuss
ISIS militants appear to behead abducted American journalist James Wright Foley in graphic video,1093,discuss
Missing Mexico students not among 28 bodies found in mass grave,1613,discuss
"Big Bank Hank, co-founder of the Sugarhill Gang, has died",2398,agree
Pope Francis turns out not to have made pets in heaven comment,1835,unrelated
"Reports Isis fighters have contracted Ebola are 'incorrect', says Iraqi health ministry",1891,discuss
'Snake wine' to the rescue of Kim Jong-un's love life,941,unrelated
Christian Bale Is Steve Jobs,2252,unrelated
Kim Jong-un 'Had Surgery on Fractured Ankles',1457,unrelated
"Seven High School Girls Get Pregnant On Five-Day School Trip, Parents Outraged",557,unrelated
Islamic State reports youngest jihadist 'martyred' in battle,1572,unrelated
Insurgents killed in Nigeria despite alleged truce with Boko Haram,35,unrelated
ISIL militant 'Jihadi John' named by media,1572,unrelated
"US Drones, Hunting for ISIS Leader, Seen Flying over Syrian Airspace",304,unrelated
Christian Bale won't play Steve Jobs,1897,unrelated
Isis 'fed murdered kidnap victim to his own mother after she travelled to their headquarters and demanded to see him',724,unrelated
Aaron Sorkin Confirms Christian Bale Will Play Steve Jobs,1234,unrelated
Sugarhill Gang's Big Bank Hank Dead At 57,2340,discuss
"Man chops off own penis, throws it in a dustbin after poor show in bed",1379,unrelated
"Suspected meteorite leaves crater in Managua, is linked to asteroid",2118,unrelated
Audio recording allegedly captures moment Michael Brown was shot,1435,unrelated
Did Kim Yo-Jong Take Kim Jong Un’s Role? North Korea Ill Health Rumors Are ‘Fabricated’,744,discuss
"Boko Haram claims to have German hostage, denies ceasefire",800,unrelated
Mexico police find mass grave near site 43 students vanished,761,unrelated
Was Heart-Tugging Viral Video Of Generous Homeless Man All A Hoax?,1395,unrelated
Oscar winner Christian Bale to play Steve Jobs in upcoming biopic,137,unrelated
Report: A Radically Redesigned 12-Inch MacBook Air Is Coming,2299,unrelated
This Week In Weird News: Horrible Human Slaps Elderly Woman For Sneezing,687,unrelated
Jihadi John UNMASKED: Islamic State killer NAMED as west Londoner Mohammed Emwazi,1427,unrelated
London hip-hop artist Abdel-Majed Abdel Bary key suspect in hunt for killer of American journalist James Foley,1598,discuss
Elderly Woman Arrested for Kidnapping Neighbor’s Cats & Making Fur Coats,2016,unrelated
Killing in the name of! Kim Jong-un launches attack on others named 'Kim Jong-un',979,unrelated
"In Vogue vs Rats War, the Rats Are Winning",2031,agree
‘Star Wars: The Force Awakens’ May Get An Early Release Date—Report,633,unrelated
J.J. Abrams Asks Disney To Move Up 'Star Wars: The Force Awakens' Release Date,1269,discuss
Not coming to a store near you: The pumpkin spice condom,609,unrelated
An Audio Recording of the Michael Brown Shooting Has Reportedly Surfaced,1776,discuss
American hostage killed in rescue attempt in Yemen - senior official,2184,unrelated
Rapper identified as James Foley's executioner: reports,1263,unrelated
Kimye’s Fault? Anna Wintour’s NYC ‘Vogue’ Offices Hit With Disgusting Rat Infestation: ‘Rat Droppings On Desks’,1940,unrelated
Amazon's first brick-and-mortar store said to open in Manhattan,1355,unrelated
Someone Spraypainted A Penis On A £1.5m Bugatti Veyron And It Went Very Viral,557,unrelated
Newly Discovered Mass Grave Linked to Missing Mexican Students,1613,discuss
Kim Jong-un 'set to open a new restaurant in SCOTLAND',2314,unrelated
Comcast Says You Can Keep Your Tor,1461,unrelated
ISIL Beheads American Photojournalist in Iraq,1574,unrelated
"Boko Haram Could Release Kidnapped Girls, Nigerian Officials Say",571,unrelated
Lebanon 'holding IS leader's daughter and ex-wife',1192,discuss
Giant 8ft 9in catfish weighing 19 stone caught in Italy is thought to be the biggest ever reeled in with a rod and line,2196,agree
"Planetary Alignment On Jan 4, 2015 Will Decrease Gravity For 5 Minutes Causing Partial Weightlessness",2403,unrelated
"ISIS beheads American photo-journalist James Wright Foley, threatens more to come",1471,agree
"Viral Video Of Homeless Man Spending $100 On Food For Other Homeless Was Faked, Witness Says",220,unrelated
Spider burrowed through tourist's stomach and up into his chest,633,unrelated
BATMAN VS. SUPERMAN BATMOBILE STOLEN,1939,unrelated
Apple Watch battery will require nightly charging,137,unrelated
James Foley executioner said identified as British rapper  Read more: James Foley executioner said identified as British rapper,43,unrelated
Iraqi media: ISIS militants have contracted Ebola,93,unrelated
Ottawa Shooting: Soldier Shot at Canada's National War Memorial,633,unrelated
"Op-Ed: Hoax – Priest who never existed claims he died, saw female God",1605,unrelated
"No, Islamic State Militants Have Not Been Caught by U.S. Border Patrol",220,unrelated
The Case of the Stolen Batmobile Has Been Solved,87,unrelated
ISIS militants appear to behead abducted American journalist James Wright Foley in graphic video,1361,unrelated
"BATMOBILE NOT STOLEN, MTV CONTEST PRIZE REMAINS UNCLAIMED",1562,unrelated
Islamic State 'training pilots to fly fighter jets',2283,unrelated
"CNN Broadcasts Purported Audio Containing Gunshots That Felled Michael Brown Jr.; Leaders, Celebrities Fill Pews At Teen’s Funeral",2118,discuss
Was Alleged Audio of Michael Brown Shooting on CNN a Hoax?,958,unrelated
Robot security guards now patrolling Microsoft's Silicon Valley campus,696,unrelated
A Predator Drone Has Reportedly Been Spotted Circling Above ISIS's Capital City,649,unrelated
Ebola Outbreak 2015 Update: ISIS Fighters May Have Contracted Deadly Virus,75,unrelated
"Apple to Take Reservations for Trying On Apple Watch, Considered Platinum Model",239,unrelated
#HairGate: iPhone 6 Customers Are Complaining That The Phone Is Ripping Out Their Hair,781,unrelated
Isis militants claim to have killed US journalist James Foley,26,unrelated
Report: Christian Bale Drops Out Of Steve Jobs Biopic,286,unrelated
A Wanted Man Responded To A Police Facebook Post That He Would Turn Himself In,409,agree
Media outlets identify 'Jihadi John',1427,unrelated
"Gill Rosenberg, Canadian-Israeli Woman Feared Kidnapped By ISIS, Says She's Safe",1351,unrelated
Report: Christian Bale Will Play Steve Jobs,1226,discuss
Urgent: The Leader of ISIL 'Abu Bakr al-Baghdadi' Killed! / Photo,1634,discuss
Speeding Up ‘Seinfeld’ For Younger Viewers,399,unrelated
US Marine survives headshot in Afghanistan,2091,unrelated
Is Kim Jong Un's sister Kim Yo Jong in charge?,706,unrelated
Apple may launch 12-inch MacBook Air with Retina Display,1293,unrelated
Ebola Frisco 2014: Patient Shows Virus Symptoms After Apparent Thomas Eric Duncan Contact,244,unrelated
"Macaulay Culkin NOT Dead: Facebook, Twitter Death Hoax Goes Viral",891,unrelated
Al Qaida hostage killed in raid,56,unrelated
TBS Is Probably Speeding Up ‘Seinfeld’ Reruns To Fit In More Commercials,1686,unrelated
Jose Canseco shoots self in hand,695,unrelated
"L. Jinny? Abdel-Majed Abdel Bary, UK Rapper, Suspected in James Foley Killing: Reports",1603,unrelated
"No, Pumpkin Spice Condoms Are Not A Real Thing",703,unrelated
YPG Confirms: Gill Rosenberg Not Captured in Kobani,777,unrelated
SHOCK CLAIM: PGA Golfer Says Tiger Woods Is Suspended For Failed Drug Test,1877,unrelated
"No, Banksy has not been arrested (sigh)",1269,unrelated
Meteorite leaves crater in Nicaraguan capital Managua,40,unrelated
New Audio Shows Michael Brown Was Shot at 11 Times,2525,unrelated
Islamic State fighters detonate 'SCORPION bombs' in terror siege,48,unrelated
Homeless man receives $100... then shocks everyone with how he spends it,676,unrelated
ISIS militants trick mother into ‘eating her kidnapped son’,2175,unrelated
"Seven High School Girls Get Pregnant On Five-Day School Trip, Parents Outraged",1457,unrelated
SEE IT: California homeless man uses $100 gift to give food to others,359,unrelated
ADVISORY-Islamist rebel leader killed in U.S. strike - Somali government,1853,unrelated
Robot security guards now patrolling Microsoft's Silicon Valley campus,2306,unrelated
White House fence-jumper made it far deeper into building than previously known,2506,unrelated
Animal lovers abuzz over pope’s comments that 'paradise is open to all of God’s creatures',1832,disagree
New ISIS Video Shows Militants Seizing Weapons Airdropped By US Near Kobani,2223,unrelated
Hilarious: North Dakota Pays Special Tribute to President Obama,2367,unrelated
Canadian-Israeli Woman May Have Been Captured In Syria: Reports,2067,unrelated
Axl Rose Dead? Of Course Not — Tiresome Internet Death Hoax Plague Hits Guns N’ Roses Frontman,2459,unrelated
Saudi Arabian cleric issues fatwa against snowmen,599,unrelated
Isis Syria News: Video Shows US Airdropped Weapons and Grenades 'Captured by Islamic State',1648,unrelated
"Rare meteorite impact causes blast in Nicaragua's capital, Managua",2118,unrelated
Audio may have captured Michael Brown shooting,346,unrelated
"Boko Haram Could Release Kidnapped Girls, Nigerian Officials Say",459,unrelated
Lynch mob chop man's penis off after catching him allegedly trying to rape teenager,43,unrelated
"In Moscow, police are looking for a felon, cut the male genitals",2044,agree
“Axl Rose dead 2014” : Guns N' Roses frontman killed by internet death hoax,292,agree
Nicaragua asks U.S. for help investigating meteorite crater,2129,unrelated
"Islamic State, in video titled ""A Message to America,"" beheads American journalist James Wright Foley who was kidnapped in 2012",704,unrelated
URGENT: ISIS leader Abu Bakr al-Baghdadi allegedly killed by US airstrikes,2036,unrelated
20-year-old burger: McDonald's Quarter Pounder looks eerily new after 2 decades,1806,unrelated
"Tiger Woods PED, PGA Tour Suspension Allegations Retracted by Dan Olsen",1867,unrelated
Mexico police find mass grave near site 43 students vanished,1670,unrelated
DNA test confirms child is IS head Abu Bakr al-Baghdadi's daughter,2337,disagree
BREAKING NEWS: Baseball star Jose Canseco hurt in accidental shooting,1772,unrelated
Unverified video shows beheading of aid worker David Haines,1757,discuss
Two GOP Congressmen Say Suspected Terrorists Caught Crossing U.S.–Mexico Border,1565,unrelated
"Hoax Report Claims 250,000 Texas Turkeys Infected With Ebola",2035,unrelated
Willie Nelson Dead? Viral Hoax Fools Internet,858,unrelated
"Source: Pot in NYC may soon net just a ticket, not arrest",1528,unrelated
Questions raised over Nicaragua 'meteorite',1249,discuss
Pure Evil: Islamic State Beheads American Journalist James Wright Foley,1787,unrelated
Steve Jobs Biopic Eyes Seth Rogen to Play Apple Co-Founder Steve Wozniak,1670,unrelated
Kim Jong-Un's Scottish Dog Meat Restaurant Is Probably Fabricated Shite,1535,unrelated
Bali Awry,1422,unrelated
NET Extra: Back-from-the-dead Catholic priest claims God is a female...,359,unrelated
Mexico checks if 43 missing students in mass grave,251,unrelated
Homeland Security: No ISIL fighters on U.S. border,1670,unrelated
Dog abandoned at Ayr station with belongings in suitcase,1524,unrelated
An audio recording of the Michael Brown shooting has reportedly surfaced,121,unrelated
Man chops off own penis after being dumped by his girlfriend,591,unrelated
Teen Makes $72 Million on the Stock Market,1563,disagree
Jordan’s King May Participate Personally In ISIS Raids,1365,unrelated
